{
  "$schema": "http://json-schema.org/draft-07/schema#",
  "$id": "https://github.com/JoelThornton/Powerkit/blob/main/engine/inst/schema/whole-study.schema.json",
  "title": "powerkit whole-study simulation specification",
  "description": "Experimental. One population model for a whole study, from which every planned analysis is simulated on the same data sets (run_whole_study()). Each analysis is fitted with its own model, as it would be analysed on its own. The schema checks structure; validate_whole_study() in R checks that the analyses, variables and paths fit together and that the population is possible.",
  "$comment": "spec_version 0.1. Keep old versions readable when the format changes.",
  "type": "object",
  "required": ["spec_version", "kind", "variables", "population", "analyses", "claim", "alpha", "effect_justification", "goal"],
  "additionalProperties": false,
  "properties": {
    "spec_version": {"const": "0.1"},
    "kind": {"const": "whole_study"},
    "variables": {
      "description": "Keyed by role: X (predictor), Y (outcome), W (moderator, if any analysis has one), M, or M1 and M2, for the mediators, and B, the outcome measured at baseline when each person is measured twice (every analysis then adjusts Y for B, as an ANCOVA does). All are scores (continuous), except that X may be two groups or conditions (binary).",
      "type": "object",
      "required": ["X", "Y"],
      "propertyNames": {"enum": ["X", "Y", "W", "M", "M1", "M2", "B"]},
      "additionalProperties": {
        "type": "object",
        "required": ["type", "label"],
        "additionalProperties": false,
        "properties": {
          "type": {"enum": ["continuous", "binary"]},
          "label": {"type": "string", "minLength": 1}
        }
      },
      "allOf": [{
        "properties": {
          "Y": {"properties": {"type": {"const": "continuous"}}},
          "W": {"properties": {"type": {"const": "continuous"}}},
          "M": {"properties": {"type": {"const": "continuous"}}},
          "M1": {"properties": {"type": {"const": "continuous"}}},
          "M2": {"properties": {"type": {"const": "continuous"}}},
          "B": {"properties": {"type": {"const": "continuous"}}}
        }
      }]
    },
    "mediators": {
      "description": "With two mediators (M1, M2): side by side (parallel, PROCESS model 4) or in a chain (serial, PROCESS model 6).",
      "enum": ["parallel", "serial"]
    },
    "population": {
      "type": "object",
      "required": ["paths"],
      "additionalProperties": false,
      "properties": {
        "paths": {
          "description": "Standardised path coefficients of the population model, keyed 'From->To'; product terms join the two variables ('XW->Y', 'XW->M', 'MW->Y'). Every path of the model the analyses imply must be given; use 0 for no effect.",
          "type": "object",
          "minProperties": 1,
          "additionalProperties": {"type": "number", "minimum": -1, "maximum": 1}
        },
        "x_prob": {
          "description": "With a two-group X: the share of people in X's second group (0.5, the default, for equal groups), drawn by power4mome's rbinary_rs() and standardised like every variable.",
          "type": "number",
          "exclusiveMinimum": 0,
          "exclusiveMaximum": 1
        },
        "correlations": {
          "description": "'X<->W': the correlation of X and W. 'M1<->M2': with parallel mediators, the correlation of their residuals. 'X<->B' and 'W<->B': with a baseline B, its correlations with X (0 for two groups, as when people are randomised) and W.",
          "type": "object",
          "propertyNames": {"enum": ["X<->W", "M1<->M2", "X<->B", "W<->B"]},
          "additionalProperties": {"type": "number", "exclusiveMinimum": -1, "exclusiveMaximum": 1}
        }
      }
    },
    "analyses": {
      "description": "The planned analyses, each fitted to every simulated data set with its own model. x_y: the regression of Y on X alone (the test of the correlation). interaction: Y on X, W and X x W, testing X x W. indirect: the mediation model, testing the indirect effect along 'path' by a Monte Carlo confidence interval. index_of_mome: moderated mediation (PROCESS model 7 if W moderates X -> M, model 14 if W moderates M -> Y), testing the index of moderated mediation by a Monte Carlo confidence interval.",
      "type": "array",
      "minItems": 1,
      "items": {
        "type": "object",
        "required": ["id", "label", "test", "role"],
        "additionalProperties": false,
        "properties": {
          "id": {"type": "string", "pattern": "^[a-z][a-z0-9_]*$"},
          "label": {"type": "string", "minLength": 1},
          "test": {"enum": ["x_y", "interaction", "indirect", "index_of_mome"]},
          "role": {"enum": ["main", "extra"]},
          "path": {"type": "string", "pattern": "^X->(M|M1|M2)(->M2)?->Y$"},
          "moderated_link": {"enum": ["x_m", "m_y"]}
        },
        "allOf": [
          {"if": {"properties": {"test": {"const": "indirect"}}}, "then": {"required": ["path"], "properties": {"moderated_link": false}}},
          {"if": {"properties": {"test": {"const": "index_of_mome"}}}, "then": {"required": ["moderated_link"], "properties": {"path": false}}},
          {"if": {"properties": {"test": {"enum": ["x_y", "interaction"]}}}, "then": {"properties": {"path": false, "moderated_link": false}}}
        ]
      }
    },
    "claim": {
      "description": "How the main analyses support the study's claim. each: every main result is a separate claim, each tested at alpha. all: the claim needs every main result to be significant, each tested at alpha (joint power is the chance that all are). any: any one significant main result supports the claim, each main test at alpha divided by the number of main analyses (Bonferroni; joint power is the chance that at least one is).",
      "enum": ["each", "all", "any"]
    },
    "alpha": {"type": "number", "exclusiveMinimum": 0, "exclusiveMaximum": 1},
    "effect_justification": {
      "type": "object",
      "required": ["type"],
      "additionalProperties": false,
      "properties": {
        "type": {"enum": ["smallest_effect_of_interest", "meta_analysis", "prior_study", "pilot_study", "own_study_result", "none"]},
        "source": {"type": "string", "minLength": 1},
        "adjustment": {"type": "string", "minLength": 1},
        "notes": {"type": "string"}
      }
    },
    "goal": {
      "description": "power: the power at a fixed total sample size n (analysed). sample_size: the smallest n whose power reaches 'power' (with one main analysis, its power; with several, the chance that all are significant under the claim 'all', that at least one is under 'any', and the power of each under 'each'). A search simulates every analysis at many n, so it is slow: run it on your own computer (export_whole_study_script()).",
      "type": "object",
      "required": ["type"],
      "additionalProperties": false,
      "properties": {
        "type": {"enum": ["power", "sample_size"]},
        "n": {"type": "integer", "minimum": 20},
        "power": {"type": "number", "exclusiveMinimum": 0, "exclusiveMaximum": 1}
      },
      "allOf": [
        {"if": {"properties": {"type": {"const": "power"}}}, "then": {"required": ["n"], "properties": {"power": false}}},
        {"if": {"properties": {"type": {"const": "sample_size"}}}, "then": {"required": ["power"], "properties": {"n": false}}}
      ]
    },
    "options": {
      "type": "object",
      "additionalProperties": false,
      "properties": {
        "nrep": {"type": "integer", "minimum": 100, "maximum": 1000000},
        "ci_draws": {"type": "integer", "minimum": 100, "maximum": 100000},
        "seed": {"type": "integer", "minimum": 1, "maximum": 2147483647}
      }
    }
  }
}
